{"$schema":"https://json-schema.org/draft/2020-12/schema","$defs":{"#Identifier":{"type":"string","pattern":"^[A-Za-z0-9][A-Za-z0-9._:-]*$"},"#PluginID":{"type":"string","pattern":"^[a-z][a-z0-9-]*$"},"#SourceRef":{"type":"object","additionalProperties":false,"properties":{"plugin_id":{"$ref":"#/$defs/%23PluginID"},"entity_type":{"$ref":"#/$defs/%23Identifier"},"entity_id":{"$ref":"#/$defs/%23Identifier"}},"required":["entity_id","entity_type","plugin_id"]}},"type":"object","additionalProperties":false,"properties":{"schema_version":{"const":"mission-control.command/v1"},"command_id":{"$ref":"#/$defs/%23Identifier"},"target":{"$ref":"#/$defs/%23SourceRef"},"expected_revision":{"type":"string","not":{"const":""}},"command":{"$ref":"#/$defs/%23Identifier"},"arguments":{"type":"object","additionalProperties":true}},"required":["arguments","command","command_id","expected_revision","schema_version","target"]}
